### ISSUE TITLE
add setting to disable SWARM port 12345 traffic

### ISSUE THREAD

**Issue by tonymet** [NMminer1024/ESP-Miner-NMAxe#33]
nmaxe wastes wifi air time with port 12345 (see example below).  it's roughly 367 bytes at 1 packet / sec

Please add a setting to disable warm and reduce frequency. 

The impact of this is interrupting high priority wifi traffic. 

```
22:22:52.201134 IP axeos.lan.12345 > 255.255.255.255.12345: UDP, length 366
22:22:54.313090 IP axeos.lan.12345 > 255.255.255.255.12345: UDP, length 368
22:22:56.453926 IP axeos.lan.12345 > 255.255.255.255.12345: UDP, length 368
22:22:58.647472 IP axeos.lan.12345 > 255.255.255.255.12345: UDP, length 363
22:23:00.803603 IP axeos.lan.12345 > 255.255.255.255.12345: UDP, length 368
22:23:02.900116 IP axeos.lan.12345 > 255.255.255.255.12345: UDP, length 367
22:23:05.016100 IP axeos.lan.12345 > 255.255.255.255.12345: UDP, length 366
22:23:07.174455 IP axeos.lan.12345 > 255.255.255.255.12345: UDP, length 367
22:23:09.326050 IP axeos.lan.12345 > 255.255.255.255.12345: UDP, length 363
22:23:11.586253 IP axeos.lan.12345 > 255.255.255.255.12345: UDP, length 367
22:23:13.701931 IP axeos.lan.12345 > 255.255.255.255.12345: UDP, length 367
22:23:15.887113 IP axeos.lan.12345 > 255.255.255.255.12345: UDP, length 366
22:23:18.084047 IP axeos.lan.12345 > 255.255.255.255.12345: UDP, length 365
22:23:20.231021 IP axeos.lan.12345 > 255.255.255.255.12345: UDP, length 367
22:23:22.486989 IP axeos.lan.12345 > 255.255.255.255.12345: UDP, length 367
22:23:24.605537 IP axeos.lan.12345 > 255.255.255.255.12345: UDP, length 364
22:23:24.608741 IP axeos.lan.12345 > 255.255.255.255.12345: UDP, length 364
22:23:26.692156 IP axeos.lan.12345 > 255.255.255.255.12345: UDP, length 368
22:23:28.878142 IP axeos.lan.12345 > 255.255.255.255.12345: UDP, length 368
22:23:30.958064 IP axeos.lan.12345 > 255.255.255.255.12345: UDP, length 365
22:23:33.057882 IP axeos.lan.12345 > 255.255.255.255.12345: UDP, length 368
22:23:35.228687 IP axeos.lan.12345 > 255.255.255.255.12345: UDP, length 367
22:23:37.331498 IP axeos.lan.12345 > 255.255.255.255.12345: UDP, length 368
22:23:39.507472 IP axeos.lan.12345 > 255.255.255.255.12345: UDP, length 365
22:23:41.689737 IP axeos.lan.12345 > 255.255.255.255.12345: UDP, length 366
22:23:43.811327 IP axeos.lan.12345 > 255.255.255.255.12345: UDP, length 367
22:23:45.912438 IP axeos.lan.12345 > 255.255.255.255.12345: UDP, length 368
22:23:47.997773 IP axeos.lan.12345 > 255.255.255.255.12345: UDP, length 365
22:23:50.117744 IP axeos.lan.12345 > 255.255.255.255.12345: UDP, length 368
22:23:52.304755 IP axeos.lan.12345 > 255.255.255.255.12345: UDP, length 367
22:23:54.527962 IP axeos.lan.12345 > 255.255.255.255.12345: UDP, length 368
22:23:56.719002 IP axeos.lan.12345 > 255.255.255.255.12345: UDP, length 366
22:23:58.830474 IP axeos.lan.12345 > 255.255.255.255.12345: UDP, length 368
22:24:00.994536 IP axeos.lan.12345 > 255.255.255.255.12345: UDP, length 367
22:24:03.091327 IP axeos.lan.12345 > 255.255.255.255.12345: UDP, length 368
22:24:05.128883 IP axeos.lan.12345 > 255.255.255.255.12345: UDP, length 364
22:24:07.242904 IP axeos.lan.12345 > 255.255.255.255.12345: UDP, length 368
22:24:09.346665 IP axeos.lan.12345 > 255.255.255.255.12345: UDP, lengt
```
